<module id="test" xmlns="http://www.entwinemedia.com/weblounge/3.2/module"
  xmlns:xsi="http://www.w3.org/2001/XMLSchema-instance"
  xsi:schemaLocation="http://www.entwinemedia.com/weblounge/3.2/module http://www.entwinemedia.com/xsd/weblounge/3.2/module.xsd">

  <enable>true</enable>
  <name>Testmodule</name>

  <pagelets>
    <pagelet id="content" composeable="false">
      <name>Page content showcase</name>
      <renderer>file://${module.root}/pagelets/content.jsp</renderer>
      <recheck>1d10M</recheck>
      <valid>1w1d1H1M</valid>
      <includes>
        <link href="file://${module.root}/css/greeting.css" rel="stylesheet"
          type="text/css" />
        <script src="file://${module.root}/scripts/greeting.js"
          type="text/javascript" />
      </includes>
    </pagelet>
    <pagelet id="include" composeable="false">
      <name>Pagelet includes showcase</name>
      <renderer>file://${module.root}/pagelets/include.jsp</renderer>
      <recheck>1d10M</recheck>
      <valid>1w1d1H1M</valid>
      <includes>
        <link href="file://${module.root}/css/greeting.css" rel="stylesheet"
          type="text/css" />
      </includes>
    </pagelet>
    <pagelet id="i18n" composeable="false">
      <name>I18n internationalization showcase</name>
      <renderer>file://${module.root}/pagelets/i18n.jsp</renderer>
    </pagelet>
    <pagelet id="nested" composeable="false">
      <name>Nested property tags showcase</name>
      <renderer>file://${module.root}/pagelets/nested.jsp</renderer>
    </pagelet>
    <pagelet id="editing" composeable="false">
      <name>Page editing showcase</name>
      <renderer>file://${module.root}/pagelets/editing.jsp</renderer>
      <editor>file://${module.root}/pagelets/editing_editor.jsp</editor>
    </pagelet>
    <pagelet id="modificationdate" composeable="true">
      <name>Modification date</name>
      <renderer>file://${module.root}/pagelets/modificationdate.jsp</renderer>
    </pagelet>
  </pagelets>

  <actions>
    <action id="greeter.html">
      <name>Greetings</name>
      <class>ch.entwine.weblounge.test.site.GreeterHTMLAction</class>
      <mountpoint>/greeting</mountpoint>
      <includes>
        <script src="file://${module.root}/scripts/greeting.js"
          type="text/javascript" />
      </includes>
    </action>
    <action id="greeter.html-targeted">
      <name>Greetings</name>
      <class>ch.entwine.weblounge.test.site.GreeterHTMLAction</class>
      <mountpoint>/greeting-targeted</mountpoint>
      <page>/test/htmlaction</page>
      <includes>
        <script src="file://${module.root}/scripts/greeting.js"
          type="text/javascript" />
      </includes>
    </action>
    <action id="greeter.html-templated">
      <name>Greetings</name>
      <class>ch.entwine.weblounge.test.site.GreeterHTMLAction</class>
      <mountpoint>/greeting-templated</mountpoint>
      <template>alternate</template>
      <includes>
        <script src="file://${module.root}/scripts/greeting.js"
          type="text/javascript" />
      </includes>
    </action>
    <action id="greeter.xml">
      <name>XML Greetings</name>
      <class>ch.entwine.weblounge.test.site.GreeterXMLAction</class>
      <mountpoint>/greeting/xml</mountpoint>
    </action>
    <action id="greeter.json">
      <name>JSON Greetings</name>
      <class>ch.entwine.weblounge.test.site.GreeterJSONAction</class>
      <mountpoint>/greeting/json</mountpoint>
    </action>
  </actions>

  <jobs>
    <job id="startup">
      <name>Job title</name>
      <class>ch.entwine.weblounge.test.site.SiteStartupJob</class>
      <schedule>@restart</schedule>
    </job>
  </jobs>

  <imagestyles>
    <imagestyle id="none">
      <name>Original size</name>
      <scalingmode>none</scalingmode>
    </imagestyle>
    <imagestyle id="box">
      <name>Scale to bounding box</name>
      <scalingmode>box</scalingmode>
      <width>250</width>
      <height>250</height>
    </imagestyle>
    <imagestyle id="cover">
      <name>Scale to cover area</name>
      <scalingmode>cover</scalingmode>
      <width>250</width>
      <height>250</height>
    </imagestyle>
    <imagestyle id="fill">
      <name>Scale to fill area and crop</name>
      <scalingmode>fill</scalingmode>
      <width>250</width>
      <height>250</height>
    </imagestyle>
    <imagestyle id="width">
      <name>Scale to fit width</name>
      <scalingmode>width</scalingmode>
      <width>250</width>
    </imagestyle>
    <imagestyle id="height">
      <name>Scale to fit height</name>
      <scalingmode>height</scalingmode>
      <height>250</height>
    </imagestyle>
  </imagestyles>

</module>