<?xml version="1.0" encoding="UTF-8"?>
<module id="repository" xmlns="http://www.entwinemedia.com/weblounge/3.2/module" xmlns:xsi="http://www.w3.org/2001/XMLSchema-instance"
  xsi:schemaLocation="http://www.entwinemedia.com/weblounge/3.2/module http://www.entwinemedia.com/xsd/weblounge/3.2/module.xsd">
  
  <enable>true</enable>
  <name>Media</name>
  
  <pagelets>
    <pagelet id="download" composeable="true">
      <name>Download</name>
      <renderer>file://${module.root}/jsp/download/download.jsp</renderer>
      <editor>file://${module.root}/jsp/download/download_editor.jsp</editor>
      <includes>
        <link use="editor" href="file://${module.root}/jsp/download/download.css" rel="stylesheet" type="text/css"></link>
        <script use="editor" src="file://${module.root}/jsp/download/download.js" type="text/javascript"></script>
      </includes>
    </pagelet>
    
    <pagelet id="image" composeable="true">
      <name>Image</name>
      <renderer>file://${module.root}/jsp/image/image.jsp</renderer>
      <renderer type="feed">file://${module.root}/jsp/image/image.jsp</renderer>
      <editor>file://${module.root}/jsp/image/image_editor.jsp</editor>
      <includes>
        <link use="renderer" href="file://${module.root}/jsp/image/apple_overlay.css" rel="stylesheet" type="text/css"></link>
        <link use="editor" href="file://${module.root}/jsp/image/image.css" rel="stylesheet" type="text/css"></link>
        <script jquery="1.6" use="renderer" src="file://${module.root}/jsp/image/apple_overlay.js" type="text/javascript"></script>
        <script use="editor" src="file://${module.root}/jsp/image/image.js" type="text/javascript"></script>
      </includes>
    </pagelet>
    
    <pagelet id="gallery" composeable="true">
      <name>Image gallery</name>
      <renderer>file://${module.root}/jsp/gallery/gallery.jsp</renderer>
      <editor>file://${module.root}/jsp/gallery/gallery_editor.jsp</editor>
      <includes>
        <link use="editor" href="file://${module.root}/jsp/gallery/gallery.css" rel="stylesheet" type="text/css"></link>
        <script use="editor" src="file://${module.root}/jsp/gallery/gallery.js" type="text/javascript"></script>
        <script use="renderer" src="file://${module.root}/js/galleria/galleria-1.2.5.min.js" type="text/javascript"></script>
      </includes>
    </pagelet>
  </pagelets>
  
  <imagestyles>
    <imagestyle id="editorpreview" composeable="true">
      <name><![CDATA[Editor Preview]]></name>
      <scalingmode>cover</scalingmode>
      <width>200</width>
      <height>150</height>
      <context>
      	<resource preview="true">all</resource>
      </context>
    </imagestyle>
  </imagestyles>
  
</module>